545,"Los Vientos","Los Vientos I, Los Vientos II, Los Vientos III, Los Vientos IV, Los Vientos V","online",0,911.699999999999,"2012, 2015, 2016","Texas","2015-Q2, 2012-Q4, 2015-Q4, 2016-QQ3","Duke Energy","Duke Energy","IPP",426,"2.0000, 2.3000, 2.4000","Mitsubishi, Siemens, Vestas","MWT102/2.4, SWT-2.3-108, V110-2.0","90, 95, 98.1","Contract: PPA","Austin Energy, Bryan Texas Utilities; Greenville Electric Utility System; Garland Power & Light, City of San Antonio - (TX)","Utility","Municipal","110.00, 200.00, 200.10, 201.60",,"2013, 2014","2037","25",577539,"Cameron, Kenedy, Starr, Willacy","TX-28, TX-34","Cuellar, Henry (D), Vela, Filemon (D)","D","Cornyn, John (R), Cruz, Ted (R)","R","31, 35, 37","Oscar Longoria (DEM), Rene Oliveira (DEM), Ryan Guillen (DEM)","DEM","21, 27","Eddie Lucio Jr. (DEM), Judith Zaffirini (DEM)","DEM","ERCOT","ERCOT","ERCOT","Electric Transmission Texas, NA",,,,,,,"57751, 57752, 59320, 59321, 60059","Los Vientos Wind 1A  LLC, Los Vientos Wind 1A LLC, Los Vientos Wind 1A, LLC, Los Vientos Wind 1B  LLC, Los Vientos Wind 1B LLC, Los Vientos Wind 1B, LLC, Los Vientos Windpower III, LLC, Los Vientos Windpower IV  LLC, Los Vientos Windpower IV, LLC, Los Vientos Windpower V  LLC, Los Vientos Windpower V LLC","57063, 57064, 59119, 59120, 59792","No","Wanzek"
546,"Lost Creek Wind","Lost Creek Wind","online",0,150,"2010, 2011","Missouri","2011-Q1, 2010-Q2","Wind Capital Group","Pattern Energy Group, Inc.","IPP",100,"1.5000","GE Renewable Energy","1.5-82.5","80","Contract: PPA","Associated Electric Coop, Inc","Utility","Cooperative","1.50, 148.50","69.95","2008","2028","20",418070,"DeKalb","MO-6","Graves, Sam (R)","R","Blunt, Roy (R), McCaskill, Claire (D)","D, R","2","Zachary Wyatt (REP)","REP","12","Brad Lager (REP)","REP","N/A","Associated Electric Cooperative, Inc.","Associated Electric Cooperative, Inc.","Unknown","Lost Creek Wind Energy Facility","150","5","2010","S",100,"57189","Lost Creek Wind LLC, Pattern Operators LP","56545, 56548","No","RMT"
547,"Lost Lakes Wind Farm","Lost Lakes Wind Farm","online",0,100.65,"2009","Iowa","2009-Q4","EDP Renewables North America LLC","EDP Renewables North America LLC","IPP",61,"1.6500","Vestas","V82-1.65","80","Contract: PPA","Tennessee Valley Authority","Utility","Federal","100.65","68.13","2012","2030","18",345516,"Dickinson","IA-4","King, Steve (R)","R","Ernst, Joni (R), Grassley, Charles (R)","R","1, 2","Chris Hall (DEM), Jeremy Taylor (REP)","DEM, REP","1","Rick Bertrand (REP)","REP","MISO","MISO","MISO","ITC Midwest LLC","Lost Lakes Wind Farm LLC","100","12","2009","S",61,"57111","Lost Lakes Wind Farm LLC","56419","No",
548,"Lower Snake River","Lower Snake River Phase I","online",0,342.700000000001,"2011, 2012","Washington","2012-Q1, 2011-Q4","Puget Sound Energy, RES Americas","Puget Sound Energy","Utility",149,"2.3000","Siemens","SWT-2.3-101","80","Direct Use: Utility-Owned","Puget Sound Energy Inc","Utility","Investor Owned","126.50, 216.20",,,,,865023,"Garfield","WA-5","McMorris Rodgers, Cathy (R)","R","Cantwell, Maria (D), Murray, Patty (D)","D","9","Susan Fagan (REP)","REP","9","Mark Schoesler (REP)","REP","N/A","BPA","BPA","Bonneville Power Administration","Lower Snake River Wind Energy Project","342",,,"S",149,"57195","Puget Sound Energy Inc","15500","No",
550,"Lundgren","Lundgren","online",0,251.000000051,"2014","Iowa","2014-Q4","EDF Renewable Energy","MidAmerican Energy","Utility",107,"2.3460","Siemens","SWT-2.3-108","80","Direct Use: Utility-Owned","MidAmerican Energy Co","Utility","Investor Owned","251.00",,,,,934315,"Webster","IA-4","King, Steve (R)","R","Ernst, Joni (R), Grassley, Charles (R)","R","48","Chip Baltimore (REP)","REP","24","Jerry Behn (REP)","REP","MISO","MISO","MISO","Unknown",,,,,,,"58884","MidAmerican Energy Co","12341","No","Wanzek"
552,"Luverne Wind","Luverne (OTP)","online",0,49.5,"2009","North Dakota","2009-Q4","Otter Tail Power","Otter Tail Power Company","Utility",33,"1.5000","GE Renewable Energy","1.5-82.5","80","Direct Use: Utility-Owned","Otter Tail Power Co","Utility","Investor Owned","49.50",,,,,182328,"Steele","ND-Congressional District (at Large)","Cramer, Kevin (R)","R","Heitkamp, Heidi (D), Hoeven, John (R)","D, R","23","Bill Devlin (REP)","REP","23","Joan Heckaman (DEM)","DEM","MISO","MISO","MISO","Minnkota Power Coop, Inc","Luverne Wind Farm","49.5","9","2009","S",33,"57031","Otter Tail Power Co","14232","No",
556,"Macho Springs Wind Farm I","Macho Springs Wind Farm I","online",0,50.4,"2011","New Mexico","2011-Q3","Element Power","Capital Power","IPP",28,"1.8000","Vestas","V100-1.8","80","Contract: PPA","Tucson Electric Power Co","Utility","Investor Owned","50.40","83.80",,,,133289,"Luna","NM-2","Pearce, Stevan (R)","R","Heinrich, Martin (D), Udall, Tom (D)","D","32","Dona Irwin (DEM)","DEM","35","John Arthur Smith (DEM)","DEM","N/A","Tucson Electric Power Company","Tucson Electric Power Company","El Paso Electric Co",,,,,,,"57947","Capital Power Corporation, Element Power US LLC","57327, 59365","No","Mortenson"
558,"Macksburg","Macksburg","online",0,119.646,"2014","Iowa","2014-Q4","RPM Access Wind Development","MidAmerican Energy","Utility",51,"2.3460","Siemens","SWT-2.3-108","80","Direct Use: Utility-Owned","MidAmerican Energy Co","Utility","Investor Owned","119.65",,,,,374541,"Madison","IA-3","Young, David (R)","R","Ernst, Joni (R), Grassley, Charles (R)","R","25","Brian Moore (REP)","REP","13","Tod Bowman (DEM)","DEM","MISO","MISO","MISO","MidAmerican Energy Co",,,,,,,"58885","MidAmerican Energy Co","12341","No","Mortenson"
561,"Magic Valley","Bruenning's Breeze, Magic Valley","online",0,431.28,"2012, 2017","Texas","2012-Q3, 2017-Q4","E.ON Climate & Renewables","E.ON Climate & Renewables, Enbridge","IPP",188,"1.8150, 3.0000","Nordex USA, Vestas","AW125/3000, V100-1.8","80, 87.5","Contract: PPA, Undisclosed","Undisclosed","Utility","Municipal","40.66, 162.62, 228.00",,,,,638389,"Willacy","TX-34","Vela, Filemon (D)","D","Cornyn, John (R), Cruz, Ted (R)","R","31","Ryan Guillen (DEM)","DEM","27","Eddie Lucio Jr. (DEM)","DEM","ERCOT","ERCOT","ERCOT","AEP Texas Central Company, AEP Texas Inc",,,,,,,"57802","E ON Climate Renewables N America LLC","56215","No","Blattner Energy"
563,"Majestic II","Majestic II","online",0,79.6,"2012","Texas","2012-Q3","NextEra Energy Resources","NextEra Energy Resources","IPP",51,"1.5000, 1.6000","GE Renewable Energy","1.5-82.5, 1.6-82.5","80","Contract: PPA","Southwestern Electric Power Co","Utility","Investor Owned","30.00, 49.60","31.50","2011","2032","21",286803,"Carson","TX-13","Thornberry, Mac (R)","R","Cornyn, John (R), Cruz, Ted (R)","R","87","Four Price (REP)","REP","31","Kel Seliger (REP)","REP","SPP","SPP","SPP","Southwestern Public Service Co",,,,,,,"58363","NextEra Energy Majestic Wind, NextEra Energy Majestic Wind II","58353","No","Blattner Energy"
562,"Majestic Wind","Majestic I","online",0,79.5,"2009","Texas","2009-Q1","Babcock & Brown, NextEra Energy Resources","NextEra Energy Resources","IPP",53,"1.5000","GE Renewable Energy","1.5-77","80","Contract: PPA","Southwestern Electric Power Co","Utility","Investor Owned","79.50","45.00","2008","2029","21",306233,"Carson","TX-13","Thornberry, Mac (R)","R","Cornyn, John (R), Cruz, Ted (R)","R","87","Four Price (REP)","REP","31","Kel Seliger (REP)","REP","SPP","SPP","SPP","Southwestern Public Service Co","Majestic 1 Wind Farm","79.5","1","2009","W",53,"56648","NextEra Energy Majestic Wind, NextEra Energy Resources","56622, 58353","No",
564,"Mammoth Plains","Mammoth Plains","online",0,198.9,"2014","Oklahoma","2014-Q4","NextEra Energy Resources","NextEra Energy Partners","IPP",117,"1.7000","GE Renewable Energy","1.7-100","80","Contract: PPA","Southwestern Public Service Co","Utility","Investor Owned","198.90","19.18","2013","2034",,834668,"Blaine, Dewey","OK-3","Lucas, Frank (R)","R","Inhofe, James (R), Lankford, James (R)","R","59","Mike Sanders (REP)","REP","26","Tom Ivester (DEM)","DEM","SPP","Southwestern Public Service Company","Southwestern Public Service Company","Unknown",,,,,,,"59284","NextEra Energy Resources","56622","No",
565,"Manzana Wind","Manzana Wind","online",0,189,"2012","California","2012-Q4","Avangrid Renewables","Avangrid Renewables","IPP",126,"1.5000","GE Renewable Energy","1.5-77","65","Contract: PPA","City of Santa Clara - (CA), Los Angeles Department of Water & Power, San Diego Gas & Electric Co","Utility","Investor Owned, Municipal","39.00, 50.00, 100.00","91.50, 95.00","2012","2032","20",540522,"Kern","CA-23","McCarthy, Kevin (R)","R","Feinstein, Dianne (D), Harris, Kamala (D)","D","34","Shannon Grove (REP)","REP","16","Michael Rubio (DEM)","DEM","CAISO","CAISO","CAISO","Southern California Edison Co","Manzana Wind LLC","246",,,"S",126,"57484","Avangrid Renewables Inc, Iberdrola Renewables Inc","15399","No","Blattner Energy"
566,"Maple Ridge","Maple Ridge, Maple Ridge Phase 1A, Maple Ridge Phase II","online",0,321.75,"2005, 2006","New York",,"Avangrid Renewables, EDP Renewables North America LLC","Avangrid Renewables, EDP Renewables North America LLC","IPP",195,"1.6500","Vestas","V82","80","Contract: PPA, Merchant","Eversource Energy, Merchant (NYSERDA)","Utility, Wholesale Market","Investor Owned, NYSERDA","90.75, 231.00",,"2005, 2007","2017","9",764322,"Lewis","NY-21","Stefanik, Elise (R)","R","Gillibrand, Kirsten (D), Schumer, Charles (D)","D","117","Ken Blankenbush (REP)","REP","47","Joseph Griffo (REP)","REP","NYISO","NYISO","NYISO","Unknown","Maple Ridge Wind Farm","137, 33, 61, 91","1, 12, 6","2005, 2006","J",390,"56290","Flat Rock Windpower  LLC, Flat Rock Windpower LLC, Flat Rock Windpower, LLC","54684","No","RMT"
567,"Marble River","Marble River","online",0,215.25,"2012","New York","2012-Q4","EDP Renewables North America LLC","EDP Renewables North America LLC","IPP",70,"3.0750","Vestas","V112","94","Merchant","Merchant (NYSERDA)","Wholesale Market","NYSERDA","215.25",,"2012",,,522111,"Clinton","NY-21","Stefanik, Elise (R)","R","Gillibrand, Kirsten (D), Schumer, Charles (D)","D","115","Janet Duprey (REP)","REP","45","Elizabeth Little (REP)","REP","NYISO","NYISO","NYISO","Unknown","Marble River Wind Farm","200",,,"S",95,"56857","Marble River  LLC, Marble River LLC, Marble River, LLC","56072","No",
568,"Marengo","Marengo II, Marengo Wind Power Project","online",0,210.6,"2007, 2008","Washington","2008-Q3","RES Americas","PacifiCorp","Utility",117,"1.8000","Vestas","V80-1.8","67","Direct Use: Utility-Owned","PacifiCorp","Utility","Investor Owned","70.20, 140.40",,,,,526422,"Columbia","WA-5","McMorris Rodgers, Cathy (R)","R","Cantwell, Maria (D), Murray, Patty (D)","D","16","Maureen Walsh (REP)","REP","16","Mike Hewitt (REP)","REP","N/A","PacifiCorp E+W","PacifiCorp E+W","PacifiCorp","Marengo Wind Plant","140.4, 70.2","1, 8","2007, 2008","S",234,"56466","PacifiCorp","14354","No","Wanzek"
1146,"Mariah North Wind","Mariah North Wind","online",0,230.4,"2016","Texas","2016-Q4","First Reserve","BlackRock","IPP",96,"2.4000","GE Renewable Energy","2.4-107","80","Contract: Hedge","Merchant Hedge Contract (ERCOT)","Wholesale Market","ERCOT","230.40",,,,,66534,"Parmer","TX-19","Arrington, Jodey (R)","R","Cornyn, John (R), Cruz, Ted (R)","R","86","John Smithee (REP)","REP","31","Kel Seliger (REP)","REP","ERCOT","ERCOT","ERCOT","Sharyland Utilities LP",,,,,,,"59005","Mariah Holdings II LLC c/o CAMS, Mariah North West LLC","58849, 60475","No",
571,"Mars Hill","Mars Hill","online",0,42,"2006, 2007","Maine",,"Evergreen Windpower, SunEdison","Brookfield Renewable Partners, SunEdison","IPP",28,"1.5000","GE Renewable Energy","1.5-77","80","Contract: PPA, Unknown","New Brunswick Power, Unknown","Unknown, Utility","Canada, Unknown","9.00, 33.00, 42.00",,"2011","2015","4",131836,"Aroostook","ME-2","Poliquin, Bruce (R)","R","Collins, Susan (R), King, Angus (I)","I, R","6","Tyler Clark (REP)","REP","34","Roger Sherman (Rep)","Rep","ISO-NE","ISO New England Inc","ISO New England Inc","Emera Maine","Mars Hill Wind Farm Project","42","3","2007","S",28,"56448","Evergreen Wind Power LLC, First Wind O&M  LLC, First Wind O&M LLC","54853, 59155","No",
574,"Marshall Wind Energy","Marshall Wind Energy","online",0,72,"2016","Kansas","2016-Q2","BHE Renewables, RPM Access Wind Development","BHE Renewables","IPP",36,"2.0000","Vestas","V110-2.0","95","Contract: PPA","City of Independence - (MO), Kansas Municipal Energy Agency, Kansas Power Pool, Missouri Joint Municipal Electric Utility Commission","Utility","Municipal, Municipal Mktg Authority","7.00, 20.00, 25.00",,"2013, 2015",,,195067,"Marshall","KS-2","Jenkins, Lynn (R)","R","Moran, Jerry (R), Roberts, Pat (R)","R","106","Sharon Schwartz (REP)","REP","1","Dennis Pyle (REP)","REP","MISO, SPP","SPP","SPP","Westar Energy Inc",,,,,,,"59084","BHE Renewables  LLC, Marshall Wind Energy LLC","58895, 59359","No","Mortenson"
578,"McAdoo","McAdoo","online",0,150,"2008","Texas","2008-Q3","Invenergy","Invenergy","IPP",100,"1.5000","GE Renewable Energy","1.5-77","80","Contract: Hedge","Merchant Hedge Contract (ERCOT)","Wholesale Market","ERCOT","150.00",,,,,598350,"Dickens","TX-13","Thornberry, Mac (R)","R","Cornyn, John (R), Cruz, Ted (R)","R","68","Drew Springer (REP)","REP","28","Robert Duncan (REP)","REP","ERCOT","ERCOT","ERCOT","Oncor Electric Delivery Company LLC","McAdoo Wind Energy LLC","150","9","2008","S",100,"56773","Invenergy Services LLC","49893","No",
580,"McFadden Ridge","McFadden Ridge","online",0,28.5,"2009","Wyoming","2009-Q3","PacifiCorp","PacifiCorp","Utility",19,"1.5000","GE Renewable Energy","1.5-77","80","Direct Use: Utility-Owned","PacifiCorp","Utility","Investor Owned","28.50",,,,,95925,"Albany","WY-Congressional District (at Large)","Cheney, Liz (R)","R","Barrasso, John (R), Enzi, Michael (R)","R","47","Jerry Paxton (REP)","REP","11","Larry Hicks (REP)","REP","N/A","PacifiCorp E+W","PacifiCorp E+W","PacifiCorp","McFadden Ridge","28.5","10","2009","S",19,"57039","PacifiCorp","14354","No",
583,"Meadow Creek","Meadow Creek","online",0,119.7,"2012","Idaho","2012-Q4","Ridgeline Energy","DIF Management BV","IPP",57,"2.1000","Suzlon","S97","90","Contract: PPA","PacifiCorp","Utility","Investor Owned","119.70","63.04","2012","2022","10",277610,"Bonneville","ID-2","Simpson, Michael (R)","R","Crapo, Michael (R), Risch, Jim (R)","R","34","Douglas Hancey Jr. (REP)","REP","34","Brent Hill (REP)","REP","N/A","PacifiCorp E+W","PacifiCorp E+W","PacifiCorp",,,,,,,"58106","Ridgeline Energy LLC","57075","No",
584,"Meadow Lake Wind Farm","Meadow Lake I, Meadow Lake II, Meadow Lake III, Meadow Lake IV, Meadow Lake V, Meadow Lake VI","online (353), under construction (3)",0,600.850000000002,"2009, 2010, 2017","Indiana","2010-Q2, 2010-Q3, 2017-Q3, 2009-Q4, 2010-Q4","EDP Renewables North America LLC","EDP Renewables North America LLC","IPP",414,"1.5000, 1.6500, 2.0000, 2.1000, 3.4500, 3.6000","Acciona Windpower, GE Renewable Energy, Suzlon, Vestas","1.5-77, AW82/1500, S88, V110-2.0, V136-3.45, V136-3.6, V82-1.65","79, 80, 82, 95","Contract: PPA, Merchant, Unknown","Ameren Illinois Company, Commonwealth Edison Co, Cummins, Hoosier Energy REC, Inc., Merchant (PJM), Unknown, Wabash Valley Power Assn, Inc","Non-Utility, Unknown, Utility, Wholesale Market","Commercial & Industrial, Cooperative, Investor Owned, PJM, Unknown","6.30, 7.50, 25.00, 41.50, 49.95, 50.00, 67.40, 75.00, 78.50, 149.65",,"2009, 2010, 2016, 2017","2037",,467962,"White","IN-4","Rokita, Todd (R)","R","Donnelly, Joe (D), Young, Todd (R)","D, R","13, 25, 27","Don Lehe (REP), Sharon Negele (REP), Sheila Klinker (DEM)","DEM, REP","22, 7","Brandt Hershman (REP), Ronnie Alting (REP)","REP","MISO, PJM","MISO, PJM, Unknown","MISO, PJM, Unknown","Indiana Michigan Power Co, Unknown","Meadow Lake Wind Farm II LLC, Meadow Lake Wind Farm III LLC, Meadow Lake Wind Farm IV, Meadow Lake Wind Farm LLC","103.5, 199.7, 98.7, 99","10, 8, 9","2009, 2010","S",304,"57109, 57112, 57115, 57177","Meadow Lake Wind Farm II LLC, Meadow Lake Wind Farm III LLC, Meadow Lake Wind Farm IV LLC, Meadow Lake Wind Farm LLC","56417, 56420, 56423, 56520","No","White Construction"
588,"Mehoopany","Mehoopany","online",0,140.999999976,"2012","Pennsylvania","2012-Q4","BP Wind Energy","BP Wind Energy, Sempra Renewables","IPP",88,"1.6000","GE Renewable Energy","1.6-82.5","100","Contract: PPA","Old Dominion Electric Coop, Southern Maryland Elec Coop Inc","Utility","Cooperative","30.04, 110.96","57.95, 65.34","2011","2032","21",409855,"Wyoming","PA-11","Barletta, Lou (R)","R","Casey, Bob (D), Toomey, Patrick (R)","D, R","111, 117","Karen Boback (REP), Sandra Major (REP)","REP","20","Lisa Baker (REP)","REP","PJM","PJM","PJM","Unknown",,,,,,,"57769","AE Power Services LLC","55963","No","RES Americas"
589,"Mendota Hills Wind Farm","Mendota Hills, Mendota Hills Repowering","online (63), under development (1)",50.4,50.3999999999999,"2003","Illinois",,"Leeward Renewable Energy Development, LLC, Navitas Energy","ArcLight Capital Partners, Leeward Renewable Energy, LLC","IPP",63,"0.0000, 0.8000","Gamesa, Unknown","G52-0.8, Unknown OEM","65","Contract: PPA, Merchant","Digital Realty, Merchant (PJM)","Non-Utility, Wholesale Market","Commercial & Industrial, PJM","50.40",,"2006, 2017",,,82357,"Lee","IL-16","Kinzinger, Adam (R)","R","Duckworth, Tammy (D), Durbin, Richard (D)","D","90","Jerry Mitchell (REP)","REP","45","Tim Bivins (REP)","REP","PJM","PJM","PJM","Commonwealth Edison Co","Mendota Hills, LLC","50.4","11","2003","W",63,"56160","Bluarc Management Group LLC, Infigen Asset Management LLC, Leeward Asset Management  LLC, Leeward Asset Management LLC","50123","No","RMT"
590,"Meridian Way","Meridian Way I, Meridian Way II","online",0,201,"2008","Kansas","2008-Q4","EDP Renewables North America LLC","Axium Infrastructure, EDP Renewables North America LLC","IPP",67,"3.0000","Vestas","V90-3.0","80","Contract: PPA","Empire District Electric Co, Westar Energy Inc","Utility","Investor Owned","96.00, 105.00","39.00, 45.50","2007","2028","20, 21",579953,"Cloud","KS-1","Marshall, Roger (R)","R","Moran, Jerry (R), Roberts, Pat (R)","R","107","Elaine Bowers (REP)","REP","36","Allen Schmidt (DEM)","DEM","SPP","SPP","SPP","Sunflower Electric Power Corp","Cloud County Wind Farm","105, 96","12","2008","S",134,"56784","Cloud County Windfarm  LLC, Cloud County Windfarm LLC, Cloud County Windfarm, LLC","55990","No",
591,"Mesa Wind Farm","Mesa Wind Farm","decommissioned (30), online (430)",0,30.1000000000001,"1983","California",,"Zond Windsystems","Brookfield Renewable Partners","IPP",460,"0.0700","Vestas","V15",,"Contract: PPA","San Diego Gas & Electric Co","Utility","Investor Owned","2.10, 30.10",,,"2011",,7261,"Kern","CA-23","McCarthy, Kevin (R)","R","Feinstein, Dianne (D), Harris, Kamala (D)","D","34","Shannon Grove (REP)","REP","16","Michael Rubio (DEM)","DEM","CAISO","CAISO","CAISO","Southern California Edison Co","Mesa Wind Power Corp","29.9","11","1984","W",460,"50535","Airstreams LLC, Brookfield Energy Marketing LP","11556, 55761","No",
593,"Mesquite Creek","Mesquite Creek","online",0,211.22,"2015","Texas","2015-Q2","BNB Renewables, Sumitomo Corporation of America","Duke Energy, Sumitomo Corporation of America","IPP",118,"1.7900","GE Renewable Energy","1.7-100","80","Contract: PPA","Merchant (ERCOT), RECs to Mars","Non-Utility","Commercial & Industrial","211.22",,,,,727860,"Borden, Dawson","TX-11, TX-19","Arrington, Jodey (R), Conaway, K. (R)","R","Cornyn, John (R), Cruz, Ted (R)","R","83","Charles Perry (REP)","REP","28","Robert Duncan (REP)","REP","ERCOT","ERCOT","ERCOT","NA",,,,,,,"59332","Mesquite Creek Wind  LLC, Mesquite Creek Wind LLC, Sumitomo Corporation of the Americas","59131, 59900","No","Blattner Energy"
596,"Meyersdale Wind","Meyersdale","online",0,30,"2003","Pennsylvania",,"Atlantic Renewable Energy Corp, National Wind Power","NextEra Energy Resources","IPP",20,"1.5000","NEG Micon","NM72","80","Contract: PPA","First Energy Solutions Corp.","Utility","Power Marketer","30.00","39.60","2003",,,81824,"Somerset","PA-9","Shuster, Bill (R)","R","Casey, Bob (D), Toomey, Patrick (R)","D, R","69","Carl Metzgar (REP)","REP","32","Richard Kasunic (DEM)","DEM","PJM","PJM","PJM","Unknown","Meyersdale Windpower","30","12","2003","S",20,"56052","FPL Energy Meyersdale Windpower LLC","6865","No",
597,"Miami","Miami","online",0,288.6,"2014","Texas","2014-Q3","Invenergy","Invenergy","IPP",156,"1.8500","GE Renewable Energy","1.85-87","80","Contract: Hedge","Merchant Hedge Contract (ERCOT)","Wholesale Market","ERCOT","288.60",,,,,1147513,"Hemphill, Roberts","TX-13","Thornberry, Mac (R)","R","Cornyn, John (R), Cruz, Ted (R)","R","88","Ken King (REP)","REP","31","Kel Seliger (REP)","REP","ERCOT","ERCOT","ERCOT","NA",,,,,,,"58765","Invenergy Services LLC","49893","No","RMT, Inc."
601,"Michigan Wind 1","Michigan Wind 1","online",0,69,"2008","Michigan","2008-Q4","Exelon Wind, Noble Environmental","ExGen Renewables Partners LLC, John Hancock Life Insurance Co","IPP",46,"1.5000","GE Renewable Energy","1.5-77","80","Contract: PPA","Consumers Energy Co","Utility","Investor Owned","69.00","27.46","2005",,,170110,"Huron","MI-10","Mitchell, Paul (R)","R","Peters, Gary (D), Stabenow, Debbie (D)","D","84","Terry Brown (DEM)","DEM","25","Phil Pavlov (REP)","REP","MISO","MISO","MISO","Unknown","Michigan Wind 1 LLC","69","12","2008","S",46,"56416","Michigan Wind 1 LLC","54800","No","RMT"
602,"Michigan Wind 2","Michigan Wind 2","online",0,89.9999999999999,"2011","Michigan","2011-Q4","Exelon Wind","ExGen Renewables Partners LLC, John Hancock Life Insurance Co","IPP",50,"1.8000","Vestas","V100-1.8","95","Contract: PPA","Consumers Energy Co","Utility","Investor Owned","90.00","83.63",,,,347695,"Sanilac","MI-10","Mitchell, Paul (R)","R","Peters, Gary (D), Stabenow, Debbie (D)","D","83","Paul Muxlow (REP)","REP","25","Phil Pavlov (REP)","REP","MISO","MISO","MISO","Unknown","Michigan Wind 2","90",,,"S",50,"56659","Michigan Wind 2 LLC","56951","No","RMT"
603,"Milford Wind Corridor","Milford I, Milford II","online",0,305.5,"2009, 2011","Utah","2011-Q2, 2009-Q4","SunEdison","MTW Resources, SunEdison","IPP",165,"1.5000, 2.5000","Clipper, GE Renewable Energy","1.5-77, C99","80","Contract: PPA","City of Burbank Water and Power, City of Glendale, City of Pasadena - (CA), Los Angeles Department of Water & Power","Utility","Municipal","5.00, 5.09, 10.18, 97.00, 188.23","33.53, 47.07","2007, 2010",,,455189,"Beaver, Millard","UT-2","Stewart, Chris (R)","R","Hatch, Orrin (R), Lee, Mike (R)","R","68, 73","Merrill Nelson (REP), Michael Noel (REP)","REP","24, 28","Evan Vickers (REP), Ralph Okerlund (REP)","REP","CAISO","PacifiCorp E+W","PacifiCorp E+W","Unknown","Milford Wind Corridor I LLC, Milford Wind Corridor Stage II LLC","102, 203.5","9","2009","S",165,"57079, 57107","First Wind O&M  LLC, First Wind O&M LLC, Milford Wind Corridor Phase I LLC, Milford Wind Corridor Stage II LLC","56336, 56409, 59155","No","RMT"
605,"Milo","Milo","online",0,49.65,"2015, 2016","New Mexico","2016-Q1, 2015-Q4","EDF Renewable Energy, Infinity Wind Power","BlackRock, EDF Renewable Energy","IPP",25,"1.6500, 2.0000","Vestas","V100-2.0","80","Merchant","Merchant (SPP)","Wholesale Market","SPP","18.00, 31.65",,,,,199426,"Roosevelt","NM-2","Pearce, Stevan (R)","R","Heinrich, Martin (D), Udall, Tom (D)","D","66","Bob Wooley (REP)","REP","27","Stuart Ingle (REP)","REP","SPP","SPP","SPP","Southwestern Public Service Co",,,,,,,"59838","EDF Renewable Asset Holdings  Inc0","57170","No",
606,"Minco","Minco I, Minco II, Minco III","online",0,300.8,"2010, 2011, 2012","Oklahoma","2010-Q4, 2011-Q4, 2012-Q4","NextEra Energy Resources","NextEra Energy Resources","IPP",188,"1.6000","GE Renewable Energy","1.6-100, 1.6-82.5","80","Contract: PPA","Golden Spread Electric Cooperative, Inc, Google Energy, Public Service Co of Oklahoma","Non-Utility, Utility","Commercial & Industrial, Cooperative, Investor Owned","99.20, 100.80","26.90, 33.00, 37.21","2010, 2011","2030, 2031, 2032","20, 21",371378,"Caddo, Canadian, Grady","OK-3, OK-4","Cole, Tom (R), Lucas, Frank (R)","R","Inhofe, James (R), Lankford, James (R)","R","56, 60","Dan Fisher (REP), David Perryman (DEM)","DEM, REP","23, 26","Ron Justice (REP), Tom Ivester (DEM)","DEM, REP","SPP","Oklahoma Gas and Electric Company, Unknown","Oklahoma Gas and Electric Company, Unknown","Unknown","Minco Wind I, LLC","99.2","12","2010","S",62,"57590, 57956, 58203","FPLE Minco Wind LLC, FPLE Wind  LLC, FPLE Wind LLC, FPLE Wind, LLC","56925","No","Blattner Energy"
607,"Minden Wind Park","Minden Wind Park","online",0,32,"2012","Michigan","2012-Q4","DTE Energy","DTE Energy","Utility",20,"1.6000","GE Renewable Energy","1.6-100","96","Direct Use: Utility-Owned","The DTE Electric Company","Utility","Investor Owned","32.00",,,,,111795,"Sanilac","MI-10","Mitchell, Paul (R)","R","Peters, Gary (D), Stabenow, Debbie (D)","D","83","Paul Muxlow (REP)","REP","25","Phil Pavlov (REP)","REP","MISO","MISO","MISO","Unknown",,,,,,,"57852","DTE Electric Company, The DTE Electric Company","5109","No","Barton Malow"
608,"MinnDakota Wind Farm","MinnDakota Wind Farm","online",0,150,"2007","Minnesota, South Dakota",,"Avangrid Renewables","Avangrid Renewables","IPP",100,"1.5000","GE Renewable Energy","1.5-77","80","Contract: PPA","Northern States Power Co - Minnesota","Utility","Investor Owned","54.00, 96.00","39.00","2005",,,561746,"Brookings","MN-7, SD-Congressional District (at Large)","Noem, Kristi (R), Peterson, Collin (D)","D, R","Franken, Al (D), Klobuchar, Amy (D), Rounds, Mike (R), Thune, John (R)","D, R","22A, 4","Joe Schomacker (REP), Val Rausch (Rep)","Rep, REP","22, 4","Bill Weber (REP), Timothy Begalka (REP)","REP","MISO","MISO","MISO","Northern States Power Co - Minnesota","MinnDakota Wind LLC","150","1","2008","S",100,"56459","Avangrid Renewables Inc, Iberdrola Renewables Inc","15399","No",
