253,"Dunlap","Dunlap","online",0,111,"2010","Wyoming","2010-Q4","PacifiCorp","PacifiCorp","Utility",74,"1.5000","GE Renewable Energy","1.5-77","80","Direct Use: Utility-Owned","PacifiCorp","Utility","Investor Owned","111.00",,,,,388498,"Carbon","WY-Congressional District (at Large)","Cheney, Liz (R)","R","Barrasso, John (R), Enzi, Michael (R)","R","47","Jerry Paxton (REP)","REP","11","Larry Hicks (REP)","REP","N/A","PacifiCorp E+W","PacifiCorp E+W","PacifiCorp","Dunlap","111","10","2010","S",74,"57299","PacifiCorp","14354","No",
256,"Dutch Hill","Dutch Hill","online",0,37.5,"2009","New York","2009-Q1","SunEdison","SunEdison","IPP",15,"2.5000","Clipper","C96","80","Merchant","Merchant (NYSERDA)","Wholesale Market","NYSERDA","37.50",,,,,73098,"Steuben","NY-23","Reed, Tom (R)","R","Gillibrand, Kirsten (D), Schumer, Charles (D)","D","133","Bill Nojay (REP)","REP","58","Thomas O'Mara (REP)","REP","NYISO","NYISO","NYISO","Unknown","Dutch Hill Wind Project","37.5","1","2009","S",15,"56633","Canandaigua Power Partners II LLC, First Wind O&M  LLC, First Wind O&M LLC","55888, 59155","No",
262,"Echo","Echo","online",0,112,"2014","Michigan","2014-Q1, 2014-Q3","DTE Energy","DTE Energy","Utility",70,"1.6000","GE Renewable Energy","1.6-100","96","Direct Use: Utility-Owned","The DTE Electric Company","Utility","Investor Owned","51.20, 60.80",,,,,399911,"Huron","MI-10","Mitchell, Paul (R)","R","Peters, Gary (D), Stabenow, Debbie (D)","D","84","Terry Brown (DEM)","DEM","25","Phil Pavlov (REP)","REP","MISO","MISO","MISO","Unknown",,,,,,,"58121","DTE Electric Company","5109","No",
76,"Echo 1-7","Big Top, Butter Creek Power, Oregon Trail Windfarm, Pacific Canyon Windfarm, Sand Ranch Windfarm, Wagon Trail, Ward Butte Windfarm","online",0,44.55,"2009","Oregon","2009-Q2","Exelon Wind","Exelon Wind, Other","IPP, Unknown",27,"1.6500","Vestas","V82","80","Contract: QF","PacifiCorp","Utility","Investor Owned","1.65, 3.30, 4.95, 6.60, 8.25, 9.90",,,,,,"Morrow, Umatilla","OR-2","Walden, Greg (R)","R","Merkley, Jeff (D), Wyden, Ron (D)","D","57, 58","Bob Jenson (REP), Greg Smith (REP)","REP","29","David Nelson (REP)","REP","N/A","PacifiCorp E+W","PacifiCorp E+W","PacifiCorp","Big Top LLC, Butter Creek Power LLC, Oregon Trail Windfarm LLC, Pacific Canyon Windfarm LLC, Sand Ranch Windfarm LLC, Wagon Trail LLC, Ward Butte Windfarm LLC","1.7, 3.3, 5, 6.6, 8.3, 9.9","6","2009","S",27,"56967, 56968, 56971, 56972, 56973, 56974, 56975","Big Top LLC, Butter Creek Power LLC, Echo 1, Echo 3, Oregon Trail Windfarm LLC, Pacific Canyon Windfarm LLC, Sand Ranch Windfarm LLC, Wagon Trail LLC, Ward Butte Windfarm LLC","56238, 56239, 56242, 56243, 56244, 56245, 56246, 56802, 56804","No, Yes",
263,"Eclipse","Eclipse","online",0,200.1,"2012","Iowa","2012-Q4","Clipper Windpower Development Company","MidAmerican Energy","Utility",87,"2.3000","Siemens","SWT-2.3-108","80","Direct Use: Utility-Owned","MidAmerican Energy Co","Utility","Investor Owned","200.10",,,,,747511,"Guthrie","IA-3, IA-4","King, Steve (R), Young, David (R)","R","Ernst, Joni (R), Grassley, Charles (R)","R","12, 20","Linda Upmeyer (REP), Walt Rogers (REP)","REP","10, 6","Jeff Danielson (DEM), Merlin Bartz (REP)","DEM, REP","MISO","MISO","MISO","MidAmerican Energy Co",,,,,,,"57873","MidAmerican Energy Co","12341","No","Wanzek"
264,"EcoGrove","EcoGrove","online",0,100.5,"2009","Illinois","2009-Q3","Acciona Energy","Acciona Energy","IPP",67,"1.5000","Acciona Windpower","AW82/1500","80","Merchant","Merchant (PJM)","Wholesale Market","PJM","100.50",,"2009",,,250936,"Stephenson","IL-17","Bustos, Cheri (D)","D","Duckworth, Tammy (D), Durbin, Richard (D)","D","89","Jim Sacia (REP)","REP","45","Tim Bivins (REP)","REP","PJM","PJM","PJM","Unknown","EcoGrove Wind LLC","100.5","7","2009","S",67,"56805","Acciona Wind Energy USA LLC","55918","No",
1087,"El Cabo","El Cabo","online",0,298.2,"2017","New Mexico","2017-Q4","Avangrid Renewables","Avangrid Renewables","IPP",142,"2.1000","Siemens Gamesa Renewable Energy","G114-2.1","80","Contract: PPA","Southern California Edison Co","Utility","Investor Owned","298.20",,"2016","2037",,,"Torrance","NM-1","Lujan Grisham, Michelle (D)","D","Heinrich, Martin (D), Udall, Tom (D)","D","70","Richard Vigil (DEM)","DEM","39","Phil Griego (DEM)","DEM","CAISO","CAISO, Public Service Company of New Mexico","CAISO, Public Service Company of New Mexico","Public Service Co of NM",,,,,,,,,,"No",
270,"Elbow Creek Wind Farm","Elbow Creek Wind Farm","online",0,121.9,"2008","Texas","2008-Q4","NRG Energy","NRG Yield","IPP",53,"2.3000","Siemens","SWT-2.3-93","80","Merchant","Merchant (ERCOT), RECs to Green Mountain Energy","Wholesale Market","ERCOT","121.90",,,,,355282,"Howard","TX-19","Arrington, Jodey (R)","R","Cornyn, John (R), Cruz, Ted (R)","R","72","Drew Darby (REP)","REP","31","Kel Seliger (REP)","REP","ERCOT","ERCOT","ERCOT","Oncor Electric Delivery Company LLC","Elbow Creek Wind Project LLC","121.9","12","2008","S",53,"56783","Elbow Creek Wind Project LLC","55981","No",
272,"Electra Wind","Electra Wind","online",0,230,"2016","Texas","2016-Q4","Lincoln Clean Energy","Munich RE Group, Starwood Energy","IPP",100,"2.3000","GE Renewable Energy","2.3-116","80","Contract: Hedge","Merchant Hedge Contract (ERCOT)","Wholesale Market","ERCOT","230.00",,,,,,"Wilbarger","TX-13","Thornberry, Mac (R)","R","Cornyn, John (R), Cruz, Ted (R)","R","69","James Frank (REP)","REP","30","Craig Estes (REP)","REP","ERCOT","ERCOT","ERCOT","NA",,,,,,,,,,"No","Blattner"
273,"Elk","Elk","online",0,42.5,"2011","Iowa","2011-Q4","RPM Access Wind Development","BlackRock, RPM Access Wind Development","IPP",17,"2.5000","Nordex USA","N100/2500","100","Contract: PPA","Central Iowa Power Cooperative","Utility","Cooperative","42.50","48.50","2010","2031","20",142166,"Delaware","IA-1","Blum, Rod (R)","R","Ernst, Joni (R), Grassley, Charles (R)","R","96","Cecil Dolecheck (REP)","REP","48","Joni Ernst (REP)","REP","MISO","MISO","MISO","ITC Midwest LLC","Elk Wind Farm","40.8",,,"S",17,"57417","Elk Wind Energy LLC, RPMA Operations LLC","56744, 60423","Yes",
274,"Elk City","Elk City, Elk City II","online",0,199.7,"2009, 2010","Oklahoma","2009-Q4, 2010-Q4","NextEra Energy Resources","NextEra Energy Partners, NextEra Energy Resources","IPP",109,"1.5000, 1.6000, 2.3000","GE Renewable Energy, Siemens","1.5-82.5, SWT-2.3-93","80","Contract: PPA, Merchant","NextEra Energy Power Marketing, Public Service Co of Oklahoma","Utility","Investor Owned, Power Marketer","28.80, 72.00, 98.90","37.80","2009, 2011","2030","21",699488,"Beckham, Roger Mills","OK-3","Lucas, Frank (R)","R","Inhofe, James (R), Lankford, James (R)","R","55","Todd Russ (REP)","REP","26","Tom Ivester (DEM)","DEM","SPP","SPP","SPP","Public Service Co of Oklahoma","Elk City LLC","98.9, 99.2","12","2009, 2010","S",182,"57346","Elk City LLC","56683","No",
275,"Elk River","Elk River","online",0,150,"2005","Kansas",,"Avangrid Renewables","Avangrid Renewables","IPP",100,"1.5000","GE Renewable Energy","1.5-77","80","Contract: PPA","Empire District Electric Co","Utility","Investor Owned","150.00","25.25","2004","2025","21",507687,"Butler","KS-4","Estes, Ron (R)","R","Moran, Jerry (R), Roberts, Pat (R)","R","12","Jim Kelly (REP)","REP","14","Dwayne Umbarger (REP)","REP","SPP","SPP","SPP","Westar Energy Inc","Elk River Wind","150","12","2005","S",100,"56303","Avangrid Renewables Inc, Iberdrola Renewables Inc","15399","No",
276,"Elkhorn Ridge","Elkhorn Ridge","online",0,80.000000001,"2009","Nebraska","2009-Q1","Edison Mission Group","NRG Yield, Tenaska Inc","IPP",27,"3.0000","Vestas","V90-3.0","80","Contract: PPA","City of Grand Island - (NE), Lincoln Electric System, Municipal Energy Agency of NE, Nebraska Public Power District, Omaha Public Power District","Utility","Municipal, Political Subdivision","1.00, 6.00, 8.00, 25.00, 40.00","45.87","2008","2029","21",260004,"Knox","NE-3","Smith, Adrian (R)","R","Fischer, Deb (R), Sasse, Ben (R)","R",,,,"40","Tyson Larson (REP)","REP","MISO, SPP","SPP","SPP","Nebraska Public Power District","Elkhorn Ridge Wind LLC","81","3","2009","J",27,"56947","Edison Mission Energy, NRG Energy Gas & Wind Holdings Inc","34505, 59883","No",
277,"Elkhorn Valley","Elkhorn Valley","online",0,100.65,"2007, 2008","Oregon","2008-Q1","EDP Renewables North America LLC","Borealis, EDP Renewables North America LLC","IPP",61,"1.6500","Vestas","V82-1.65","70","Contract: PPA","Idaho Power Co","Utility","Investor Owned","3.30, 47.70, 49.65",,"2006","2027","20",331119,"Union","OR-2","Walden, Greg (R)","R","Merkley, Jeff (D), Wyden, Ron (D)","D","58","Bob Jenson (REP)","REP","29","David Nelson (REP)","REP","N/A","Idaho Power Co.","Idaho Power Co.","Idaho Power Co","Elkhorn Valley Wind Farm","100.7","12","2007","S",61,"56623","Telocaset Wind Power Partners","55880","No",
278,"Elm Creek","Elm Creek I, Elm Creek II","online",0,247.8,"2008, 2010","Minnesota","2008-Q4, 2010-Q4","Avangrid Renewables","Avangrid Renewables","IPP",128,"1.5000, 2.4000","GE Renewable Energy, Mitsubishi","1.5-77, MWT95/2.4","80","Contract: PPA, Merchant","Avangrid Renewables, Great River Energy","Utility","Cooperative, Power Marketer","99.00, 148.80","48.25","2007, 2010","2025","18",328729,"Jackson, Martin","MN-1","Walz, Timothy (D)","D","Franken, Al (D), Klobuchar, Amy (D)","D","23A","Bob Gunther (REP)","REP","23","Julie Rosen (REP)","REP","MISO","MISO","MISO","Unknown","Elm Creek Wind II LLC, Elm Creek Wind LLC","148.8, 99","12","2008, 2010","S",128,"56793, 57649","Avangrid Renewables Inc, Iberdrola Renewables Inc","15399","No",
279,"Endeavor Wind","Endeavor I, Endeavor II","online",0,150,"2007, 2008","Iowa","2008-Q2, 2008-Q3, 2008-Q4","Clipper Windpower Development Company, NextEra Energy Resources","NextEra Energy Resources","IPP",60,"2.5000","Clipper","C96","80","Contract: PPA","Great River Energy, Madison Gas & Electric Co","Utility","Cooperative, Investor Owned","12.50, 25.00, 50.00, 62.50","39.08, 57.00","2008, 2010","2018, 2041","10, 30",310317,"Osceola","IA-4","King, Steve (R)","R","Ernst, Joni (R), Grassley, Charles (R)","R","1","Jeremy Taylor (REP)","REP","1","Rick Bertrand (REP)","REP","MISO","MISO","MISO","ITC Midwest LLC, Osceola Electric Coop, Inc","Osceola Windpower II, Osceola Windpower LLC","100, 50","7, 9","2008","S",60,"56645, 56913","Osceola Windpower II, Osceola Windpower LLC","55901, 56121","No","RMT, Wanzek"
280,"Ensign","Ensign","online",0,98.8999999999999,"2012","Kansas","2012-Q4","NextEra Energy Resources","NextEra Energy Resources","IPP",43,"2.3000","Siemens","SWT-2.3-101, SWT-2.3-108","80","Contract: PPA","Kansas City Power & Light","Utility","Investor Owned","98.90","27.65","2011","2031","20",443606,"Gray","KS-1","Marshall, Roger (R)","R","Moran, Jerry (R), Roberts, Pat (R)","R","115","Ronald Ryckman (REP)","REP","38","Garrett Love (REP)","REP","SPP","SPP","SPP","Kansas City Power & Light",,,,,,,"58137","NextEra Energy Resources Ensign Wind","58090","No","Blattner Energy"
288,"Eva Creek","Eva Creek","online",0,24.6,"2012","Alaska","2012-Q4","Golden Valley Elec Assn Inc","Golden Valley Electric Association","Utility",12,"2.0500","Senvion","MM92","78.5","Direct Use: Utility-Owned","Golden Valley Elec Assn Inc","Utility","Cooperative","24.60",,,,,,"Denali","AK-Congressional District (at Large)","Young, Don (R)","R","Murkowski, Lisa (R), Sullivan, Dan (R)","R","38","Bob Herron (DEM)","DEM","S","Lyman Hoffman (DEM)","DEM","N/A","NA","NA","Golden Valley Elec Assn Inc",,,,,,,"57935","Golden Valley Elec Assn Inc","7353","Yes","Michels"
290,"Ewington","Ewington","online",0,21,"2008","Minnesota","2008-Q2","Exelon Wind","Exelon Wind","IPP",10,"2.1000","Suzlon","S88","79","Contract: PPA","Northern States Power Co - Minnesota","Utility","Investor Owned","21.00",,,,,,"Jackson","MN-1","Walz, Timothy (D)","D","Franken, Al (D), Klobuchar, Amy (D)","D","22B","Rod Hamilton (REP)","REP","22","Bill Weber (REP)","REP","MISO","MISO","MISO","Unknown","Prairie Wind Power LLC","4","1","2008","S",2,"56628","Exelon Wind LLC, Prairie Wind Power LLC","55885, 56805","Yes",
296,"Exelon Wind 4","Exelon Wind 4","online",0,79.8,"2008","Texas","2008-Q1","DWS, Exelon Wind, NextEra Energy Resources","Exelon Wind","IPP",38,"2.1000","Suzlon","S88","79","Contract: PPA","Southwestern Public Service Co","Utility","Investor Owned","79.80","79.80","2006","2026","19",249811,"Hansford","TX-13","Thornberry, Mac (R)","R","Cornyn, John (R), Cruz, Ted (R)","R","88","Ken King (REP)","REP","31","Kel Seliger (REP)","REP","SPP","SPP","SPP","Southwestern Public Service Co","EXC Wind 4 LLC","79.8","1","2008","S",38,"56560","EXC Wind 4, EXC Wind 4 LLC","55835","No",
306,"Fair Wind","Fair Wind","online",0,30,"2015","Maryland","2015-Q4","Exelon Wind","Exelon Wind","IPP",12,"2.5000","Nordex USA","N100/2500","100","Direct Use: Utility-Owned","Constellation Energy Commodities","Utility","Power Marketer","30.00",,,,,91215,"Garrett","MD-6","Delaney, John (D)","D","Cardin, Benjamin (D), Van Hollen, Chris (D)","D","1A","Wendell Beitzel (REP)","REP","1","George Edwards (REP)","REP","PJM","PJM","PJM","Unknown",,,,,,,"59147","Fair Wind Power Partners","58962","No","WCI"
1187,"Falvez Astra","Falvez Astra","online",0,163.2,"2017","Texas","2017-Q1","WindHQ","WindHQ","IPP",68,"2.4000","GE Renewable Energy","2.4-107","80","Merchant","Merchant (ERCOT)","Wholesale Market","ERCOT","163.20",,,,,,"Randall","TX-13","Thornberry, Mac (R)","R","Cornyn, John (R), Cruz, Ted (R)","R","86","John Smithee (REP)","REP","31","Kel Seliger (REP)","REP","ERCOT","ERCOT","ERCOT","Sharyland Utilities LP",,,,,,,,,,"No",
309,"Farmers City","Farmers City","online",0,146,"2009","Missouri","2009-Q2","Avangrid Renewables","Avangrid Renewables","IPP",73,"2.0000","Gamesa","G87-2.0","78","Merchant","Avangrid Renewables","Utility","Power Marketer","146.00",,"2009",,,315679,"Atchison","MO-6","Graves, Sam (R)","R","Blunt, Roy (R), McCaskill, Claire (D)","D, R","1","Craig Redmon (REP)","REP","12","Brad Lager (REP)","REP","MISO","MISO","MISO","Unknown","Farmers City Wind LLC","146","4","2009","S",73,"56767","Avangrid Renewables Inc, Iberdrola Renewable Energies USA, Iberdrola Renewables Inc","15399, 55720","No",
310,"Fenner Wind","Fenner Wind","online",0,30,"2001, 2012","New York","2001-Q4, 2012-Q4","Atlantic Renewable Energy Corp, Enel Green Power North America","Enel Green Power North America","IPP",20,"1.5000","GE Renewable Energy, Goldwind","1.5-70.5, GW82/1500","85","Merchant","Merchant (NYSERDA)","Wholesale Market","NYSERDA","30.00",,,,,62451,"Madison","NY-22","Tenney, Claudia (R)","R","Gillibrand, Kirsten (D), Schumer, Charles (D)","D","121","Bill Magee (DEM)","DEM","53","David Valesky (DEM)","DEM","NYISO","NYISO","NYISO","Unknown","Fenner Wind","30","10","2001","S",20,"55790","CHI Energy Inc","34688","No",
311,"Fenton","Fenton","online",0,205.5,"2007","Minnesota",,"EDF Renewable Energy","EDF Renewable Energy","IPP",137,"1.5000","GE Renewable Energy","1.5-77","80","Contract: PPA","Northern States Power Co - Minnesota","Utility","Investor Owned","205.50","36.90","2005","2032","27",735765,"Murray, Nobles","MN-1, MN-7","Peterson, Collin (D), Walz, Timothy (D)","D","Franken, Al (D), Klobuchar, Amy (D)","D","22A","Joe Schomacker (REP)","REP","22","Bill Weber (REP)","REP","MISO","MISO","MISO","Unknown","Fenton Wind Farm","205.5","9","2007","S",137,"56617","EDF Renewable Asset Holdings  Inc0, EDF Renewable Asset Holdings Inc0, EDF Renewable Services Inc, Enxco Service Corporation","57170, 5906","No",
315,"Flat Ridge 2","Flat Ridge 2","online",0,470.000000064,"2012","Kansas","2012-Q4","BP Wind Energy","BP Wind Energy, Sempra Renewables","IPP",294,"1.6000","GE Renewable Energy","1.6-100, 1.6-87","80","Contract: PPA","Arkansas Electric Coop Corp, Associated Electric Coop, Inc, Southwestern Electric Power Co","Utility","Cooperative, Investor Owned","51.16, 108.70, 310.14","31.50, 32.00, 35.94","2011, 2012","2032, 2037","20, 21, 25",1767716,"Barber, Harper, Kingman","KS-4","Estes, Ron (R)","R","Moran, Jerry (R), Roberts, Pat (R)","R","114, 116","Kyle Hoffman (REP), Mitch Holmes (REP)","REP","32","Steve Abrams (REP)","REP","SPP","SPP","SPP","Westar Energy Inc",,,,,,,"57787","AE Power Services LLC","55963","No","Blattner Energy"
316,"Flat Ridge I","Flat Ridge I","online",0,50,"2009","Kansas","2009-Q1","BP Wind Energy, Westar Energy","BP Wind Energy","IPP",20,"2.5000","Clipper","C96","80","Contract: PPA","Westar Energy Inc","Utility","Investor Owned","50.00","40.45","2007","2029","22",159431,"Barber","KS-4","Estes, Ron (R)","R","Moran, Jerry (R), Roberts, Pat (R)","R","116","Kyle Hoffman (REP)","REP","32","Steve Abrams (REP)","REP","SPP","SPP","SPP","Westar Energy Inc","Flat Ridge Wind Energy LLC","50","3","2009","W",20,"56879","AE Power Services LLC","55963","No","RMT"
317,"Flat Ridge I (Westar)","Flat Ridge I (Westar)","online",0,50,"2009","Kansas","2009-Q1","BP Wind Energy, Westar Energy","Westar Energy","Utility",20,"2.5000","Clipper","C96","80","Direct Use: Utility-Owned","Westar Energy Inc","Utility","Investor Owned","50.00",,,,,145288,"Barber","KS-4","Estes, Ron (R)","R","Moran, Jerry (R), Roberts, Pat (R)","R","116","Kyle Hoffman (REP)","REP","32","Steve Abrams (REP)","REP","SPP","SPP","SPP","Westar Energy Inc","Flat Ridge Wind Farm","50","2","2009","S",20,"56819","Westar Energy Inc","22500","No","RMT"
318,"Flat Water","Flat Water","online",0,60,"2010","Nebraska","2010-Q4","juwi Wind","Elawan Wind, Santander Bank, N. A.","IPP",40,"1.5000","GE Renewable Energy","1.5-82.5","80","Contract: PPA","Omaha Public Power District","Utility","Political Subdivision","60.00","55.25","2009",,,216680,"Richardson","NE-3","Smith, Adrian (R)","R","Fischer, Deb (R), Sasse, Ben (R)","R",,,,"1","Lavon Heidemann (REP)","REP","SPP","SPP","SPP","Omaha Public Power District","Flat Water Wind Farm","10.5, 60","12","2010","S",47,"57283","Flat Water Wind Farm LLC","56625","No","RES Americas"
712,"Fluvanna","Fluvanna I, Fluvanna II","online (74), under construction (1)",0,155.4,"2017","Texas","2017-Q4","Tri Global Energy","Terna Energy","IPP",74,"0.0000, 2.1000","Siemens Gamesa Renewable Energy, Unknown","G114-2.1, Unknown OEM","80","Contract: Hedge, Unknown","Merchant Hedge Contract (ERCOT), Unknown","Unknown, Wholesale Market","ERCOT, Unknown","152.00, 155.40",,,,,,"Borden, Scurry","TX-19","Arrington, Jodey (R)","R","Cornyn, John (R), Cruz, Ted (R)","R","83","Charles Perry (REP)","REP","28","Robert Duncan (REP)","REP","ERCOT","ERCOT","ERCOT","Oncor Electric Delivery Company LLC, Unknown",,,,,,,"59245","Tri Global Energy, LLC","59056","No","Wanzek"
320,"Flying Cloud","Flying Cloud","online",0,43.5,"2003","Iowa",,"Clipper Windpower Development Company","Avangrid Renewables","IPP",29,"1.5000","GE Renewable Energy","1.5-70.5","80","Contract: PPA","Interstate Power and Light Co","Utility","Investor Owned","43.50","43.50","2002","2018","15",131197,"Dickinson","IA-4","King, Steve (R)","R","Ernst, Joni (R), Grassley, Charles (R)","R","1","Jeremy Taylor (REP)","REP","1","Rick Bertrand (REP)","REP","MISO","MISO","MISO","ITC Midwest LLC","Flying Cloud Power Partners LLC","43.5","12","2003","S",29,"56172","Avangrid Renewables Inc, Iberdrola Renewables Inc","15399","No",
323,"Foote Creek I","Foote Creek Rim I","online",0,41.4000000000001,"1999","Wyoming","1999-Q2","SeaWest WindPower, Tomen Power Corp","Eugene Water and Electric Board, PacifiCorp","Utility",69,"0.6000","Mitsubishi","MWT-600-47","60","Direct Use: Utility-Owned","City of Eugene - (OR), PacifiCorp","Utility","Investor Owned, Municipal","8.78, 32.62",,,,,138352,"Carbon","WY-Congressional District (at Large)","Cheney, Liz (R)","R","Barrasso, John (R), Enzi, Michael (R)","R","47","Jerry Paxton (REP)","REP","11","Larry Hicks (REP)","REP","N/A","BPA, PacifiCorp E+W","BPA, PacifiCorp E+W","PacifiCorp","Foote Creek I","41.4","4","1999","J",69,"55607","AES Wind Generation Inc, PacifiCorp","14354, 19740","No",
321,"Foote Creek III","Foote Creek III","online",0,24.75,"1999","Wyoming","1999-Q2","M&N Wind Power, SeaWest WindPower","Terra-Gen Power","IPP",33,"0.7500","NEG Micon","NM44","45","Contract: QF, Unknown","PacifiCorp, Undisclosed","Utility","Investor Owned, Municipal","0.25, 24.50",,,,,,"Carbon","WY-Congressional District (at Large)","Cheney, Liz (R)","R","Barrasso, John (R), Enzi, Michael (R)","R","47","Jerry Paxton (REP)","REP","11","Larry Hicks (REP)","REP","N/A","PacifiCorp E+W","PacifiCorp E+W","PacifiCorp","Foote Creek III","24.8","6","1999","W",33,"55609","AES Wind Generation Inc, Terra-Gen Operating Co LLC","19740, 2770","No",
327,"Forest Creek","Forest Creek","online",0,124.2,"2006","Texas","2006-Q4","Airtricity, Renewable Generation Inc.","E.ON Climate & Renewables","IPP",54,"2.3000","Siemens","SWT-2.3-93","80","Contract: PPA","Luminant Energy","Utility","Power Marketer","124.20",,,"2021","15",308508,"Sterling","TX-11","Conaway, K. (R)","R","Cornyn, John (R), Cruz, Ted (R)","R","72","Drew Darby (REP)","REP","28","Robert Duncan (REP)","REP","ERCOT","ERCOT","ERCOT","Oncor Electric Delivery Company LLC","Forest Creek Wind Farm LLC","124.2","12","2006","S",54,"56394","E ON Climate Renewables N America Inc, E ON Climate Renewables N America LLC","56215","No",
331,"Forward","Forward","online",0,29.4,"2008","Pennsylvania","2008-Q2","Edison Mission Group","NRG Yield","IPP",14,"2.1000","Suzlon","S88","79","Contract: PPA","Constellation Energy Commodities","Utility","Power Marketer","29.40","64.00","2006","2017","11",56344,"Somerset","PA-12","Rothfus, Keith (R)","R","Casey, Bob (D), Toomey, Patrick (R)","D, R","72","Frank Burns (DEM)","DEM","32","Richard Kasunic (DEM)","DEM","PJM","PJM","PJM","Unknown","Forward Windpower LLC","29.4","4","2008","S",14,"56699","Edison Mission Energy, NRG Energy Gas & Wind Holdings Inc","34505, 59883","No",
332,"Forward Energy Center","Forward Energy Center","online",0,129,"2008","Wisconsin","2008-Q1, 2008-Q2","Invenergy","Invenergy","IPP",86,"1.5000","GE Renewable Energy","1.5-77","80","Contract: PPA","Madison Gas & Electric Co, Wisconsin Power & Light Co, Wisconsin Public Service Corp, WPPI Energy","Utility","Investor Owned, Municipal Mktg Authority","16.50, 27.50, 57.50","64.00","2006","2017","11",319889,"Dodge, Fond du Lac","WI-6","Grothman, Glenn (R)","R","Baldwin, Tammy (D), Johnson, Ron (R)","D, R","39, 52","Jeremy Thiesfeldt (REP), Mark Born (REP)","REP","13, 18","Rick Gudex (REP), Scott Fitzgerald (REP)","REP","MISO","MISO","MISO","American Transmission Systems Inc","Forward Wind Energy Center","30, 99","5, 7","2008, 2009","S",106,"56942","Invenergy Services LLC","49893","No","White Construction"
336,"Fourmile Ridge","Fourmile Ridge","online",0,40,"2014","Maryland","2014-Q4","Exelon Wind","ExGen Renewables Partners LLC, John Hancock Life Insurance Co","IPP",16,"2.5000","Nordex USA","N100/2500","100","Merchant","Merchant (PJM)","Wholesale Market","PJM","40.00",,,,,129173,"Garrett","MD-6","Delaney, John (D)","D","Cardin, Benjamin (D), Van Hollen, Chris (D)","D","1A","Wendell Beitzel (REP)","REP","1","George Edwards (REP)","REP","PJM","PJM","PJM","Unknown",,,,,,,"58904","Fourmile Wind Energy  LLC, Fourmile Wind Energy LLC, Fourmile Wind Energy, LLC","58784","No","White Construction"
337,"Fowler Ridge 1","Fowler Ridge 1, Fowler Ridge 2, Fowler Ridge 3","online",0,600.299999933998,"2009","Indiana","2009-Q1, 2009-Q4","BP Wind Energy, Dominion Energy","BP Wind Energy, Dominion Energy, Sempra Renewables","IPP",355,"1.5000, 1.6500, 2.5000","Clipper, GE Renewable Energy, Vestas","1.5-77, C96, V82, V82-1.65","80","Contract: PPA","Appalachian Power Co, Dominion Energy Marketing Inc., Indiana Michigan Power Co, Ohio Power Co, Vectren South","Utility","Investor Owned, Power Marketer","50.13, 99.00, 99.74, 100.43, 200.87","47.00, 57.80, 72.50","2007, 2008, 2009","2029","20, 21, 22",1480131,"Benton","IN-4","Rokita, Todd (R)","R","Donnelly, Joe (D), Young, Todd (R)","D, R","13","Sharon Negele (REP)","REP","6","Sue Landske (REP)","REP","PJM","PJM","PJM","Unknown","Fowler Ridge Wind Farm LLC","100, 200, 201.3, 99","12, 2, 3","2009","J, W",1065,"56777","AE Power Services LLC","55963","No","Mortenson, RMT"
339,"Franklin County","Franklin County","online",0,99.0000000000001,"2012","Iowa","2012-Q4","Alliant Energy","Interstate Power and Light Co","Utility",60,"1.6500","Vestas","V82","80","Merchant","Merchant (MISO)","Wholesale Market","MISO","99.00",,,,,257192,"Franklin","IA-4","King, Steve (R)","R","Ernst, Joni (R), Grassley, Charles (R)","R","54","Ron Jorgensen (REP)","REP","27","Bill Anderson (REP)","REP","MISO","MISO","MISO","ITC Midwest LLC",,,,,,,"57844","Franklin County Wind LLC","57171","No",
1090,"Frontier","Frontier I, Frontier II, Frontier III","online (61), under construction (2)",0,199.8,"2016","Oklahoma","2016-Q4","Duke Energy","Duke Energy","IPP",61,"0.0000, 3.0000, 3.3000","Unknown, Vestas","Unknown OEM, V126-3.3","87","Contract: PPA, Unknown","City Utilities of Springfield - (MO), Unknown","Unknown, Utility","Municipal, Unknown","152.00, 199.80, 200.00",,"2015","2038",,24545,"Kay","OK-3","Lucas, Frank (R)","R","Inhofe, James (R), Lankford, James (R)","R","38","Dale DeWitt (REP)","REP","10","Eddie Fields (REP)","REP","SPP","SPP","SPP","Oklahoma Gas & Electric Co",,,,,,,"60218","Frontier Windpower  LLC","59998","No","Wanzek"
350,"Glacier Hills","Glacier Hills","online",0,162,"2011","Wisconsin","2011-Q4","We Energies","We Energies","Utility",90,"1.8000","Vestas","V90-3.0","80","Direct Use: Utility-Owned","Wisconsin Electric Power Co","Utility","Investor Owned","162.00",,,,,383128,"Columbia","WI-6","Grothman, Glenn (R)","R","Baldwin, Tammy (D), Johnson, Ron (R)","D, R","42","Keith Ripp (REP)","REP","14","Luther Olsen (REP)","REP","MISO","MISO","MISO","American Transmission Systems Inc","Glacier Hills","162",,,"S",90,"57199","Wisconsin Electric Power Co","20847","No",
